{
  "schema_version": "die.h03.knowledge-package.v1",
  "knowledge_package_id": "H03-KP-MVP-001",
  "holding_id": "H03",
  "version": 1,
  "rights_status": "INTERNAL_ORIGINAL",
  "source_packet": {
    "source_id": "H03-SRC-INT-001",
    "rights_status": "INTERNAL_ORIGINAL",
    "evidence_units": [
      {
        "evidence_id": "E1",
        "text": "Portable H03 engineering keeps source code, contracts, schemas, tests, receipts and governed durable data reproducible from Git plus explicit bootstrap steps."
      },
      {
        "evidence_id": "E2",
        "text": "Knowledge semantics remain separate from presentation so the same accepted knowledge can feed PDF and future output formats."
      },
      {
        "evidence_id": "E3",
        "text": "A bounded product proof preserves source identity, claim evidence, artifact hashes and build lineage instead of treating an LLM response as truth."
      },
      {
        "evidence_id": "E4",
        "text": "Unknown Founder time, cash cost, shared cost or revenue remains UNKNOWN or UNPROVEN and is never silently converted to zero."
      },
      {
        "evidence_id": "E5",
        "text": "H03 domain components do not write canonical Company economics directly; canonical Company Truth mutations remain behind the logical die-state-manager boundary."
      },
      {
        "evidence_id": "E6",
        "text": "Browser profiles, OAuth sessions and secrets are host-local capability state and are not product data or durable knowledge artifacts."
      }
    ]
  },
  "claims": [
    {
      "claim_id": "C1",
      "text": "A portable knowledge-product factory treats reproducibility artifacts as first-class deliverables.",
      "evidence_refs": [
        "E1"
      ]
    },
    {
      "claim_id": "C2",
      "text": "Knowledge Packages are presentation-independent and should compile through a Product Blueprint and Document AST before rendering.",
      "evidence_refs": [
        "E2"
      ]
    },
    {
      "claim_id": "C3",
      "text": "Every bounded product build needs explicit evidence and artifact lineage rather than model output alone.",
      "evidence_refs": [
        "E3"
      ]
    },
    {
      "claim_id": "C4",
      "text": "Economic fields that have not been observed remain UNKNOWN or UNPROVEN, never inferred as zero.",
      "evidence_refs": [
        "E4"
      ]
    },
    {
      "claim_id": "C5",
      "text": "H03 may author semantic economic observations but cannot bypass the single logical die-state-manager for canonical Company Truth.",
      "evidence_refs": [
        "E5"
      ]
    },
    {
      "claim_id": "C6",
      "text": "Authentication and browser session material stays outside product lineage and is manually reprovisioned when hosts change.",
      "evidence_refs": [
        "E6"
      ]
    }
  ]
}
